number,title,created_at,updated_at,comments,author,labels,state
1597,Another 100 new quotes and first typo fixing German,2021-07-06 12:57:54+00:00,2021-07-07 13:38:37+00:00,0,BlackSagittarius,,closed
1596,Add Welsh Language,2021-07-05 22:23:42+00:00,2021-07-05 23:14:38+00:00,0,joe-shares-stuff,,closed
1595,Add media-query for cleaner #customTextPopup for under 1050px and 600px screens,2021-07-05 04:51:01+00:00,2021-07-05 23:04:34+00:00,0,DrPoppyseed,,closed
1594,Fix stop on word replay error,2021-07-04 20:33:08+00:00,2021-07-04 20:36:41+00:00,0,lukew3,,closed
1593, Add VSCode Theme (Dark),2021-07-04 18:24:37+00:00,2021-07-05 15:58:21+00:00,7,pistasjis,,closed
1592,ctrl backspace broken with russian,2021-07-04 14:25:12+00:00,2021-07-04 15:12:18+00:00,0,monkeytypegeorge,bug,closed
1589,Add boo layout keymap,2021-07-03 06:25:09+00:00,2021-07-04 15:00:13+00:00,1,Apsu,,closed
1588,command line input place holder shows html code with single list enabled,2021-07-01 21:05:10+00:00,2021-07-04 15:18:50+00:00,0,monkeytypegeorge,bug,closed
1587,New German quotes,2021-07-01 20:56:46+00:00,2021-07-04 17:10:09+00:00,1,BlackSagittarius,,closed
1586,Commandline update,2021-07-01 14:41:35+00:00,2021-10-02 01:08:22+00:00,0,Miodec,,closed
1585,include tags in presets,2021-07-01 11:24:06+00:00,2021-07-01 15:55:54+00:00,0,monkeytypegeorge,,closed
1584,Removed questionable words,2021-06-30 17:56:21+00:00,2021-07-06 23:07:38+00:00,0,unrealapex,,closed
1583,Crown tooltip is always empty,2021-06-30 12:21:30+00:00,2021-07-05 14:02:40+00:00,14,pingshunhuangalex,bug,closed
1582,Purging offensive words/words not appropriate for a workplace(NSFW) in language files from Monkeytype,2021-06-30 02:21:59+00:00,2021-07-05 23:14:20+00:00,3,unrealapex,,closed
1580,added ez-mode theme updated into dark theme,2021-06-29 01:08:59+00:00,2021-06-29 18:26:31+00:00,0,kraiztmatte,,closed
1579,Added min burst,2021-06-26 16:53:11+00:00,2021-06-29 17:55:59+00:00,1,yzAlvin,,closed
1578,More Quotes,2021-06-26 03:12:31+00:00,2021-08-28 00:43:52+00:00,3,unrealapex,,closed
1577,Updated CONTRIBUTING.md,2021-06-26 02:18:44+00:00,2021-07-06 23:07:35+00:00,3,unrealapex,,closed
1574,Add Pinyin Language,2021-06-24 20:54:23+00:00,2021-06-26 00:15:42+00:00,0,KeebCathedral,,closed
1573,Suggestion,2021-06-24 13:29:12+00:00,2021-06-26 00:17:39+00:00,1,karstenhunstad,,closed
1572,Revise czech_10k.json,2021-06-23 20:25:52+00:00,2021-06-26 00:15:16+00:00,0,CrumblyLiquid,,closed
1571,Renamed command line setting timer-progress bar,2021-06-23 19:36:33+00:00,2021-06-26 00:14:52+00:00,0,unrealapex,,closed
1570,Min burst setting,2021-06-23 15:51:30+00:00,2021-06-29 18:27:03+00:00,1,Miodec,new feature,closed
1569,added IFK ez-mode theme,2021-06-23 15:11:59+00:00,2021-06-23 18:55:49+00:00,4,kraiztmatte,,closed
1568,pressing both shift keys simultaneously while using opposite shift mode causes keys not to be inputted,2021-06-22 20:39:17+00:00,2021-06-23 17:28:18+00:00,0,sbreaks,bug,closed
1567,stats say afk while not being afk,2021-06-22 17:14:11+00:00,2021-06-23 18:20:57+00:00,3,iamlambda,bug,closed
1565,82 new French quotes,2021-06-22 14:15:05+00:00,2021-06-24 09:25:11+00:00,0,precondition,,closed
1561,Added urdu1k and updated orignal,2021-06-21 19:46:59+00:00,2021-06-23 18:24:12+00:00,1,BalkoBalkho,,closed
1560,Caret offset during typing,2021-06-20 14:36:27+00:00,2021-06-20 14:38:08+00:00,1,TheBB,bug,closed
1559,Fix typo in link,2021-06-20 13:55:20+00:00,2021-06-20 14:19:42+00:00,0,givensuman,,closed
1558,"Site crashes when using ""Practise missed words"" on small sets of missed words",2021-06-19 20:49:22+00:00,2021-06-20 13:54:34+00:00,0,50an6xy06r6n,bug,closed
1556,fix GitHub spelling on about page,2021-06-18 19:24:03+00:00,2021-06-20 12:27:33+00:00,3,pistasjis,,closed
1553,Update security-policy.html,2021-06-16 20:12:48+00:00,2021-07-06 23:07:35+00:00,0,unrealapex,,closed
1550,Add English 200,2021-06-16 13:23:52+00:00,2021-06-16 14:07:56+00:00,1,bl0bcode,,closed
1548,Update filipino.json,2021-06-15 10:41:49+00:00,2021-06-15 16:51:40+00:00,0,Killer8Hyper,,closed
1547,Fixed a typo in lithuanian quotes,2021-06-15 08:39:37+00:00,2021-06-15 16:50:38+00:00,0,Brachyurus,,closed
1546,Fixed a typo in lithuanian_3k,2021-06-15 08:38:19+00:00,2021-06-15 16:50:02+00:00,0,Brachyurus,,closed
1545,Update lithuanian_3k.json. Fixed a typo,2021-06-15 08:37:10+00:00,2021-06-15 08:37:18+00:00,0,Brachyurus,,closed
1544,fix typo,2021-06-15 08:33:19+00:00,2021-06-15 16:49:29+00:00,0,sahinakkaya,,closed
1543,Favorites theme notice.,2021-06-15 00:22:43+00:00,2021-06-15 16:46:34+00:00,2,ghost,,closed
1542,Error when changing languages after re-typing quotes.,2021-06-14 08:57:11+00:00,2021-06-18 05:45:17+00:00,2,kiriDevs,"bug, can't reproduce",closed
1541,"""repeat quotes"" option should be added for other modes as well",2021-06-13 18:57:33+00:00,2021-07-05 22:10:47+00:00,2,Kelvets,,closed
1540,Make sure all the pages look good on mobile (including popups),2021-06-13 18:03:09+00:00,2021-10-25 00:32:31+00:00,11,navazjm,improvement,closed
1539,Added 25 new quotes,2021-06-13 16:27:27+00:00,2021-06-14 18:39:34+00:00,1,lucas-fine,,closed
1538,Fix quotes,2021-06-13 14:04:00+00:00,2021-06-13 17:40:05+00:00,0,lukew3,,closed
1537,word change,2021-06-13 11:57:48+00:00,2021-06-13 12:07:06+00:00,2,xendaya,bug,closed
1536,Update filipino.json,2021-06-12 16:42:07+00:00,2021-06-13 12:00:40+00:00,0,Killer8Hyper,,closed
1535,fix english quote error,2021-06-11 16:38:42+00:00,2021-06-13 11:59:26+00:00,0,drambique,,closed
1533,How to install?,2021-06-11 04:04:26+00:00,2021-06-11 04:06:28+00:00,1,MrDerpAU,,closed
1529,luyeesg - spanish quotes correction,2021-06-10 16:25:21+00:00,2021-06-10 16:27:20+00:00,0,yerovyespitia,,closed
1527,"Different values for ""time typing"" statistic",2021-06-10 09:09:03+00:00,2021-08-06 22:12:07+00:00,25,kiriDevs,"bug, stuck",closed
1526,"Fixed ""The Tudors - Wolsey's Last Prayer"" quote error",2021-06-09 18:59:34+00:00,2021-06-09 19:01:36+00:00,0,lukew3,,closed
1525,I cant type ê and î in french because the accents dont seem to work,2021-06-09 11:29:06+00:00,2021-06-09 12:51:44+00:00,1,petertwishart,bug,closed
1524,Styled Reset and Unlink Discord Popups,2021-06-09 04:26:59+00:00,2021-06-10 15:16:22+00:00,0,Estebene,,closed
1523,➕📜 Add Arabic 10K words list,2021-06-08 02:56:58+00:00,2021-07-04 21:38:08+00:00,2,zefr0x,,closed
1522,Add poetry mode to funbox,2021-06-07 18:18:12+00:00,2021-06-08 15:10:17+00:00,1,benjaminpotter,,closed
1521,Add Bangla language,2021-06-06 21:14:12+00:00,2021-06-08 15:05:19+00:00,5,Iftakharpy,,closed
1520,Add Urdu,2021-06-05 18:51:37+00:00,2021-06-07 19:20:32+00:00,3,BalkoBalkho,,closed
1518,Change node version in CONTRIBUTING.md,2021-06-05 15:04:20+00:00,2021-06-06 13:46:10+00:00,0,victorbnl,,closed
1515,Add Esperanto,2021-06-05 12:49:59+00:00,2021-06-08 15:07:58+00:00,2,victorbnl,,closed
1514,"Opposite shift mode, app hangs and I inevitably enter an incorrect letter",2021-06-04 21:50:46+00:00,2021-07-04 19:36:32+00:00,13,zenVentzi,"bug, waiting for update, can't reproduce",closed
1513,"Signed out, can't log back in.",2021-06-04 21:25:17+00:00,2021-06-04 22:58:25+00:00,1,zenVentzi,bug,closed
1507,Power Mode continuation,2021-06-04 07:06:40+00:00,2021-07-03 08:30:21+00:00,2,Otard95,,closed
1505,Add Security Policy,2021-06-04 02:04:02+00:00,2021-06-04 11:54:36+00:00,2,tcbutler320,,closed
1504,Add Monkey Power (Power Mode - Easter-Egg),2021-06-03 18:19:02+00:00,2021-06-04 06:56:23+00:00,10,Otard95,,closed
1503,Tribe Chat User Impersonation | CWE-285: Improper Authorization,2021-06-03 01:17:53+00:00,2021-06-03 15:26:07+00:00,2,tcbutler320,bug,closed
1500,Updated templates,2021-06-01 19:30:54+00:00,2021-07-06 23:07:30+00:00,0,unrealapex,,closed
1499,Account data not displayed on account page,2021-06-01 16:13:40+00:00,2021-06-01 19:00:17+00:00,7,unrealapex,bug,closed
1498,Potential Security Issue,2021-06-01 14:11:55+00:00,2021-06-01 18:05:13+00:00,1,JamieSlome,,closed
1494,Feature/min acc grace,2021-05-31 19:13:42+00:00,2021-06-03 15:27:15+00:00,6,Otard95,,closed
1491,adding malagasy words json file,2021-05-31 10:02:58+00:00,2021-06-01 17:53:01+00:00,1,ryurina,,closed
1490,Added funbox to config,2021-05-31 01:12:11+00:00,2021-06-01 18:04:37+00:00,1,Estebene,,closed
1488,Always the same text when logged in,2021-05-30 19:25:12+00:00,2021-05-30 19:56:01+00:00,1,Takeo12,bug,closed
1487,"When pressing Enter after setting a (custom) wpm on the pace caret, the test counts it as an input",2021-05-30 15:24:49+00:00,2021-06-03 16:43:21+00:00,0,O-X-E-Y,bug,closed
1486,Fixed link,2021-05-30 02:22:25+00:00,2021-06-01 19:11:42+00:00,0,unrealapex,,closed
1483,Presets are broken,2021-05-29 05:49:38+00:00,2021-05-29 10:32:37+00:00,1,Eloren1,bug,closed
1482,Added Martin Fowler quote,2021-05-29 00:16:11+00:00,2021-06-01 19:11:37+00:00,0,unrealapex,,closed
1481,[tribe] Don't send extra information and update socket.io to v4,2021-05-28 19:08:28+00:00,2021-05-29 12:34:13+00:00,0,Antonio32A,,closed
1479,Presets don't save funbox settings,2021-05-28 14:34:16+00:00,2021-06-01 18:04:37+00:00,0,Munzu,bug,closed
1477,Accuracy and WPM Live Count overlap,2021-05-27 16:54:15+00:00,2021-05-27 22:04:04+00:00,1,chinmayprele,bug,closed
1476,Stored Cross-Site Scripting (XSS) via Tribe Chat ,2021-05-27 16:49:09+00:00,2021-05-27 22:10:49+00:00,1,tcbutler320,"bug, tribe",closed
1475,Mongo,2021-05-27 16:01:47+00:00,2021-06-06 13:45:08+00:00,22,lukew3,,closed
1474,Update Quote German,2021-05-27 06:50:09+00:00,2021-06-01 18:18:36+00:00,2,BlackSagittarius,,closed
1473,Hitting space after a mistake or first letter causes caret to move to next line,2021-05-27 02:00:52+00:00,2021-05-27 11:22:16+00:00,1,735l4,bug,closed
1472,Fixed a typo in lithuanian_1k/3k,2021-05-26 21:00:11+00:00,2021-05-26 22:58:12+00:00,0,Brachyurus,,closed
1471,fixed a typo in lithuanian_1k,2021-05-26 20:53:43+00:00,2021-05-26 20:56:27+00:00,0,Brachyurus,,closed
1470,fixed a typo in lithuanian_3k,2021-05-26 20:53:13+00:00,2021-05-26 20:56:45+00:00,0,Brachyurus,,closed
1469,Fixed search filter bug,2021-05-26 08:39:02+00:00,2021-05-26 22:55:17+00:00,0,Estebene,,closed
1468,Reset settings popup not stylized,2021-05-25 21:33:51+00:00,2021-06-10 15:16:22+00:00,0,monkeytypegeorge,,closed
1467,fixed keymap not highlighting in simon says,2021-05-25 18:16:29+00:00,2021-05-27 00:27:18+00:00,1,jnoel-dev,,closed
1466,disable shadow theme effect in result page,2021-05-25 10:06:34+00:00,2021-06-01 18:07:42+00:00,0,monkeytypegeorge,,closed
1463,Add 4 Steins;Gate quotes,2021-05-24 21:50:05+00:00,2021-05-26 22:58:47+00:00,0,Xydez,,closed
1462,Add engram layout,2021-05-24 15:28:49+00:00,2021-05-29 12:35:34+00:00,0,lttb,,closed
1459,Update pull_request_template.md,2021-05-23 17:31:13+00:00,2021-05-26 23:21:15+00:00,0,unrealapex,,closed
1458,Searching a user accounts name in DuckDuckGO seems to show the website.,2021-05-23 06:05:27+00:00,2021-05-27 11:43:15+00:00,4,ObiKeahloa,bug,closed
1457,Added connection checker,2021-05-22 02:32:57+00:00,2021-06-01 19:11:23+00:00,3,unrealapex,,closed
1456,Adding a connectivity check to Monkeytype,2021-05-22 02:13:36+00:00,2021-05-30 02:15:48+00:00,0,unrealapex,,closed
1455,Added Swift language,2021-05-22 01:46:22+00:00,2021-06-01 19:11:32+00:00,0,unrealapex,,closed
1454,Added Irish,2021-05-21 20:41:42+00:00,2021-05-26 23:21:55+00:00,2,shanedonovan,,closed
1453,Fuzzy select does not narrow down the result,2021-05-21 16:32:02+00:00,2021-05-26 23:34:00+00:00,1,Ultrahalf,bug,closed
1452,Added more lithuanian quotes.,2021-05-21 12:25:07+00:00,2021-05-22 14:38:34+00:00,0,Brachyurus,,closed
1451,Show all lines not working,2021-05-20 19:12:33+00:00,2021-05-20 23:49:16+00:00,3,connerf,bug,closed
1448,Add Swift language,2021-05-20 08:17:10+00:00,2021-05-22 14:35:40+00:00,1,Miodec,,closed
1447,Add Fledgling theme,2021-05-20 07:53:33+00:00,2021-05-22 14:32:32+00:00,0,Jashmeen,,closed
1446,Timer contrast too low on Arch theme,2021-05-19 00:25:59+00:00,2021-05-19 12:16:03+00:00,1,cyqsimon,bug,closed
1445,Stop on word causes replay bug,2021-05-18 22:59:00+00:00,2021-05-18 23:48:35+00:00,2,lukew3,bug,closed
1444,Change funbox on results screen,2021-05-18 19:16:22+00:00,2021-05-18 19:19:48+00:00,0,jnoel-dev,,closed
1443,Insertion point can't keep up with the speed when typing 200+ wpm,2021-05-18 17:54:32+00:00,2021-06-01 18:08:10+00:00,16,ghost,bug,closed
1442,Expand settings group on quick navbar click,2021-05-17 23:46:15+00:00,2021-05-18 18:53:10+00:00,3,g-thome,,closed
1441,new json,2021-05-17 20:09:58+00:00,2021-05-17 22:36:41+00:00,0,marcoferrari2409,,closed
1440,Added repeat mode to settings,2021-05-17 04:16:01+00:00,2021-05-17 14:37:23+00:00,1,Estebene,,closed
1439,Made version more clear,2021-05-17 01:40:59+00:00,2021-07-06 23:07:19+00:00,0,unrealapex,,closed
1438,C# code language does not work,2021-05-17 01:37:55+00:00,2021-05-17 13:11:12+00:00,2,mostrowski123,bug,closed
1437,Fixed a dash in lithuanian quotes.,2021-05-16 11:50:10+00:00,2021-05-16 13:16:45+00:00,0,Brachyurus,,closed
1435,Letters not highlighted at beginning when using simon says funbox. ,2021-05-15 21:55:35+00:00,2021-05-27 00:26:56+00:00,6,Banzobotic,bug,closed
1434,Made sign in text more contextual,2021-05-15 20:55:06+00:00,2021-07-06 23:07:41+00:00,0,unrealapex,,closed
1433,Add handsdown reference layout,2021-05-15 19:31:55+00:00,2021-05-15 22:46:25+00:00,0,Apsu,,closed
1432,Added repeat caret pace,2021-05-15 13:12:16+00:00,2021-05-15 23:55:39+00:00,1,Estebene,waiting for update,closed
1431,Monkey type goes to custom typing test while taking practice missed words ,2021-05-15 04:09:11+00:00,2021-05-15 22:15:20+00:00,1,anoop1005,bug,closed
1430,Removed unnecessary hyphen,2021-05-14 23:42:43+00:00,2021-07-06 23:07:14+00:00,0,unrealapex,,closed
1429,Replace curse words with sfw words,2021-05-14 23:39:22+00:00,2021-07-06 23:07:12+00:00,2,unrealapex,,closed
1428,Removed unnecessary hyphen,2021-05-14 21:19:45+00:00,2021-05-14 23:42:11+00:00,0,unrealapex,,closed
1427,add settings import and export to the command line,2021-05-14 20:14:47+00:00,2021-05-18 18:53:48+00:00,0,monkeytypegeorge,,closed
1426,Update replay timer on text click and lint warning fix,2021-05-14 16:59:30+00:00,2021-05-15 22:10:21+00:00,0,lukew3,,closed
1425,Wrong name in slovak_10k.json file,2021-05-14 11:52:34+00:00,2021-05-14 14:45:28+00:00,0,Maclogger,,closed
1424,Reverting to previous settings while trying to use practice missed words,2021-05-14 04:52:52+00:00,2021-05-14 14:14:57+00:00,0,anoop1005,bug,closed
1421,Added replay stopwatch,2021-05-14 00:24:25+00:00,2021-05-14 13:43:21+00:00,1,lukew3,,closed
1418,Adding new language: Slovak_10k,2021-05-13 20:41:28+00:00,2021-05-13 22:56:56+00:00,0,Maclogger,,closed
1417,Another typo in lithuanian_3k,2021-05-13 18:59:42+00:00,2021-05-13 22:55:45+00:00,0,Brachyurus,,closed
1414,Added click on account graph to scroll down to the test,2021-05-13 12:18:25+00:00,2021-05-17 14:46:07+00:00,2,Estebene,waiting for update,closed
1413,Fixed issue with accent colors,2021-05-13 10:09:58+00:00,2021-05-14 14:33:26+00:00,3,Estebene,,closed
1411,Accent button text color doesn't flip for light/dark,2021-05-12 21:21:36+00:00,2021-05-15 22:48:20+00:00,0,rustom,bug,closed
1410,"hide replay on screenshot, gave better name to screenshot button",2021-05-12 21:18:33+00:00,2021-05-13 23:24:49+00:00,2,lukew3,,closed
1409,Click on the account graph to scroll down to the test to see detailed stats,2021-05-12 15:14:31+00:00,2021-05-18 18:53:54+00:00,0,monkeytypegeorge,,closed
1408,Updated internal link names,2021-05-11 21:31:06+00:00,2021-07-06 23:07:22+00:00,4,unrealapex,,closed
1407,Fixed #1404 tags appearing to be active,2021-05-11 20:14:04+00:00,2021-05-12 14:59:06+00:00,0,Estebene,,closed
1404,Tags falsely showing up as enabled when loading settings,2021-05-11 15:46:23+00:00,2021-05-12 14:59:06+00:00,0,RasmitDevkota,bug,closed
1403,"Characters how need a SHIFT "" to make ö, ü or ä suddenly not working anymore. [GERMAN]",2021-05-11 05:33:09+00:00,2021-07-28 20:33:21+00:00,11,thorstenSchmitz,bug,closed
1402,Blueberry light and dark theme,2021-05-11 02:40:05+00:00,2021-05-15 22:11:31+00:00,6,raymon-zhang,waiting for update,closed
1401,indicate typos doesnt work with word highlight,2021-05-11 01:40:17+00:00,2021-05-13 23:40:30+00:00,0,monkeytypegeorge,bug,closed
1400,Additional java quotes,2021-05-11 01:22:30+00:00,2021-05-11 01:28:44+00:00,0,mtthwn,,closed
1399,Missing challenge link handlers,2021-05-10 23:30:18+00:00,2021-05-13 23:19:30+00:00,1,monkeytypegeorge,bug,closed
1398,Added Bulgarian,2021-05-10 19:41:32+00:00,2021-05-13 22:25:26+00:00,0,ivolvanov,,closed
1397,Clicking On settings#option should expand the option,2021-05-10 18:44:11+00:00,2021-05-18 18:53:09+00:00,4,antorkhan,improvement,closed
1396,Adding bulgarian,2021-05-10 16:08:42+00:00,2021-05-10 16:19:48+00:00,0,ivobelitz,,closed
1395,Custom layoutfluid doesn't work with layout names containing uppercase letters,2021-05-10 01:25:53+00:00,2021-05-10 11:46:03+00:00,1,tmwitczak,bug,closed
1394,Encode tests in URL.,2021-05-09 18:41:41+00:00,2022-02-28 20:34:53+00:00,6,te-lang-wakker,"new feature, waiting for update, frontend, Stale",closed
1393,`code_r.json` file in the wrong folder location,2021-05-09 02:48:25+00:00,2021-05-09 12:50:53+00:00,0,unrealapex,,closed
1392,Moved code_r.json file to correct folder location,2021-05-09 02:41:17+00:00,2021-05-09 12:50:53+00:00,0,unrealapex,,closed
1391,Implement light and dark theme randomization functionality,2021-05-09 00:12:29+00:00,2021-05-09 01:05:30+00:00,1,rustom,,closed
1389,More typos in lithuanian_3k.,2021-05-08 21:18:47+00:00,2021-05-09 12:51:05+00:00,2,Brachyurus,,closed
1388,Added ability to watch replay,2021-05-08 19:38:31+00:00,2021-05-08 20:33:26+00:00,3,lukew3,,closed
1387,Change British English spellings to American English,2021-05-08 18:58:23+00:00,2021-05-08 20:34:10+00:00,0,rustom,,closed
1386,Add a 'light' and 'dark' option to randomise themes. ,2021-05-08 16:38:00+00:00,2021-05-09 01:05:30+00:00,3,Miodec,improvement,closed
1385,Can you add a mode for commonly misspelled words,2021-05-08 13:47:38+00:00,2021-05-08 17:57:43+00:00,1,one-loop,,closed
1384,Refactor all the ui elements to use American spelling,2021-05-08 07:02:37+00:00,2021-05-08 20:34:10+00:00,2,omackenzie,improvement,closed
1383,Added basic preset setting functionality,2021-05-08 05:10:44+00:00,2021-05-09 01:04:35+00:00,1,Estebene,,closed
1380,adding initial list of java quotes,2021-05-08 00:30:59+00:00,2021-05-08 01:25:58+00:00,1,mtthwn,,closed
1379,Incorrect firebase auth domain with Google sign in,2021-05-07 22:58:56+00:00,2021-05-13 23:45:03+00:00,1,raymon-zhang,bug,closed
1378,Adding java quotes [low priority] [good first issue],2021-05-07 21:51:53+00:00,2021-06-01 03:47:39+00:00,5,unrealapex,,closed
1377,Made small changes to the PR template,2021-05-07 21:43:48+00:00,2021-05-12 02:25:50+00:00,0,unrealapex,,closed
1376,Renamed C# from csharp to c# and added Java quote,2021-05-07 21:31:17+00:00,2021-06-01 03:48:22+00:00,0,unrealapex,,closed
1375,Overlapping settings text after closing menu,2021-05-07 20:37:56+00:00,2021-05-07 23:12:24+00:00,1,rustom,bug,closed
1374,Updated bug report comments,2021-05-07 16:52:37+00:00,2021-05-07 17:46:10+00:00,0,unrealapex,,closed
1373,"Add missing ""on"" word to blind mode setting",2021-05-07 14:37:23+00:00,2021-05-07 15:08:39+00:00,2,ShawnNitke,,closed
1372,Improved custom prompts.,2021-05-07 10:59:24+00:00,2021-05-07 15:33:36+00:00,0,te-lang-wakker,,closed
1371,Midnight Theme,2021-05-06 23:24:07+00:00,2021-05-07 12:50:55+00:00,0,refact0r,,closed
1369,Repeat test should enable pace caret with the wpm of the previous test.,2021-05-06 16:51:41+00:00,2021-05-17 14:47:10+00:00,2,Miodec,"improvement, new feature",closed
1366,Remove duplicate quotes,2021-05-06 10:30:06+00:00,2021-05-07 23:04:34+00:00,6,omackenzie,,closed
1364,Added custom layoutfluid setting,2021-05-05 23:54:21+00:00,2021-05-08 18:38:18+00:00,0,OctahedronV2,,closed
1363,Added the R Language,2021-05-05 23:13:57+00:00,2021-07-06 23:07:01+00:00,2,unrealapex,,closed
1362,Remove tooltip on personal best icon,2021-05-05 23:02:32+00:00,2021-05-06 21:58:41+00:00,4,unrealapex,bug,closed
1361,Removing quote duplicates [low priority] [good first issue] [improvement],2021-05-05 22:22:32+00:00,2021-05-07 23:04:34+00:00,0,unrealapex,,closed
1360,Remove offensive word from English 25k,2021-05-05 21:35:14+00:00,2021-06-01 15:19:13+00:00,1,semilin,,closed
1359,Merge pull request #1 from Miodec/master,2021-05-05 21:25:01+00:00,2021-05-05 21:26:26+00:00,0,semilin,,closed
1358,Fixed some typos in lithuanian_3k.,2021-05-05 19:23:06+00:00,2021-05-07 12:53:06+00:00,0,Brachyurus,,closed
1357,RTL support in words history,2021-05-05 01:36:37+00:00,2021-05-09 13:37:52+00:00,0,zefr0x,bug,closed
1356,Update english_25k.json,2021-05-05 00:01:24+00:00,2021-05-22 14:37:50+00:00,0,huzqy,,closed
1354,Communism Theme,2021-05-04 21:52:16+00:00,2021-05-10 11:48:04+00:00,6,xnicoleisaloser,,closed
1353,39 Turkish quotes of various lengths added,2021-05-04 19:35:07+00:00,2021-05-05 15:45:54+00:00,0,yekta,,closed
1352,39 Turkish quotes of various lengths added,2021-05-04 19:29:24+00:00,2021-05-04 19:32:13+00:00,0,yekta,,closed
1350,Live counters bug on Safari,2021-05-04 11:15:50+00:00,2021-06-12 13:20:02+00:00,6,au2001,bug,closed
1348,Self Cross Site Scripting (XSS) via Word History,2021-05-04 03:26:45+00:00,2024-06-13 00:56:51+00:00,2,tcbutler320,bug,closed
1346,Disable Alt when typing so the focus won't get shifted outside the viewport,2021-05-03 14:12:07+00:00,2021-05-07 14:23:25+00:00,1,pingshunhuangalex,bug,closed
1345,Sign up/in not working on firefox,2021-05-03 13:44:16+00:00,2021-06-11 13:15:55+00:00,12,TwoDigitsOneNumber,bug,closed
1344,Added Ruby language.,2021-05-03 10:12:05+00:00,2021-05-04 12:46:32+00:00,0,Sixeight,,closed
1342,Add more typing sounds?,2021-05-02 23:14:50+00:00,2021-05-03 00:17:57+00:00,1,WolfTypist,,closed
1341,Fixed ISRT layout,2021-05-02 19:23:42+00:00,2021-05-02 19:27:47+00:00,0,ghost,,closed
1339,fixed name field within german_10k.json,2021-05-02 08:03:41+00:00,2021-05-02 13:55:01+00:00,0,Erlkoenigs,,closed
1338,Command Line interferring with the random theme fully fixed,2021-05-02 04:58:06+00:00,2021-05-02 13:56:18+00:00,0,Estebene,,closed
1337,Monkeytype lags heavily during ad transitions,2021-05-02 01:57:50+00:00,2021-05-03 15:25:08+00:00,2,unrealapex,,closed
1336,Added third lithuanian word list with 3k words.,2021-05-01 22:21:35+00:00,2021-05-02 13:57:22+00:00,0,Brachyurus,,closed
1335,Added a new list of 3000 popular lithuanian words.,2021-05-01 22:14:35+00:00,2021-05-01 22:15:53+00:00,0,Brachyurus,,closed
1333,Added Discord tag copy error handling logic and added links in table of contents,2021-05-01 19:38:19+00:00,2021-05-07 13:52:04+00:00,1,unrealapex,waiting for update,closed
1332,Fixed small grammatical errors and added links,2021-05-01 16:36:25+00:00,2021-05-01 18:13:06+00:00,0,unrealapex,,closed
1331,Add german 10k,2021-05-01 14:27:31+00:00,2021-05-01 15:08:41+00:00,0,Erlkoenigs,,closed
1330,Replace a terrible words from russian_200 with hyphen,2021-05-01 11:23:23+00:00,2021-05-01 13:44:57+00:00,0,Eloren1,,closed
1327,Fixed command line random theme bug #1326,2021-05-01 11:09:12+00:00,2021-05-01 15:11:24+00:00,0,Estebene,,closed
1326,when the theme is randomized it resets to the selected preset whenever you open and close the commandline,2021-05-01 02:02:08+00:00,2021-05-01 15:11:24+00:00,0,monkeytypegeorge,bug,closed
1325,Rewrite input system to use <input> content,2021-04-30 19:16:33+00:00,2021-09-30 16:17:04+00:00,71,SeerLite,in review,closed
1324,"Bail out command line ""Nevermind"" throws error",2021-04-30 11:08:27+00:00,2021-04-30 15:52:00+00:00,0,Estebene,bug,closed
1322,"Added 3 layouts: ISRT, Colemak-Qix, and ColemaQ",2021-04-29 22:35:29+00:00,2021-05-01 18:57:17+00:00,1,humptyhump,,closed
1321,Fixed theme preview,2021-04-29 19:01:46+00:00,2021-04-30 18:39:04+00:00,3,jnoel-dev,,closed
1320,Fixed typo in czech_10k.json,2021-04-29 07:04:12+00:00,2021-04-29 16:42:40+00:00,0,CrumblyLiquid,,closed
1316,Auto repeat edge case breaks account statistics,2021-04-28 18:16:54+00:00,2021-05-01 22:27:15+00:00,6,unrealapex,bug,closed
1315,Empty word removed.,2021-04-28 13:55:36+00:00,2021-04-28 18:05:45+00:00,0,michelkoga,,closed
1314,fixed bug with plus one funbox,2021-04-27 15:16:45+00:00,2021-04-28 10:58:18+00:00,0,jnoel-dev,,closed
1313,It would really be cool to have a button similar to punctuation for specials.,2021-04-27 12:22:03+00:00,2021-04-27 19:46:29+00:00,2,richtera,,closed
1312,Ignoring Zen Trailing AFK #966,2021-04-27 11:41:03+00:00,2021-05-01 18:19:18+00:00,7,Estebene,,closed
1311,Adding Portuguese 3k,2021-04-27 10:15:36+00:00,2021-04-28 10:58:59+00:00,0,michelkoga,,closed
1309,Funbox (plus one) not working after failing a test (master difficulty),2021-04-27 09:10:47+00:00,2021-04-28 05:21:09+00:00,1,rvjanapin,bug,closed
1308,Add highlight mode off option,2021-04-26 23:33:09+00:00,2021-04-30 20:58:03+00:00,1,Miodec,,closed
1307,command line theme preview broken,2021-04-26 22:34:37+00:00,2021-04-30 20:58:30+00:00,0,monkeytypegeorge,bug,closed
1304,Removed doubles and typos from German 1k,2021-04-25 18:25:02+00:00,2021-04-28 10:59:34+00:00,0,BlackSagittarius,,closed
1303,Add wordlist english24k,2021-04-25 15:48:20+00:00,2021-04-28 10:59:13+00:00,2,precompute,,closed
1300,Added more quotes,2021-04-24 23:47:18+00:00,2021-04-24 23:54:41+00:00,0,monkeytypegeorge,,closed
1299,Added ability to copy Miodec's discord tag in privacy policy onclick and fixed links,2021-04-24 19:03:21+00:00,2021-04-29 18:34:30+00:00,12,unrealapex,waiting for update,closed
1298,Fix typo,2021-04-24 18:24:07+00:00,2021-04-24 21:23:51+00:00,0,moverest,,closed
1297,Keys that insert two characters with one press do not work [Arabic],2021-04-24 18:14:21+00:00,2021-09-29 23:22:39+00:00,1,PAHXO,bug,closed
